{
  "$schema": "../../../schema/shot-contract.schema.json",
  "id": "s1e3-sh01",
  "chapter": "s1e3",
  "beat": "cold_open",
  "retention": "hook",
  "witness": "sanjaya",
  "camera": { "framing": "extreme_wide", "move": "push_in", "height": "high", "lensMm": 24 },
  "setting": "Kurukshetra before dawn on day 13; a low sun rakes across ranks carved like basalt relief",
  "blocking": "The Kaurava host closes into its array, rank behind rank, seen from a rise far behind the lines; no single face resolves.",
  "durationS": 6,
  "references": ["loc.kurukshetra", "style.relief_lamp"],
  "claims": ["mbh.7.33"],
  "forbidden": ["deity_face_closeup", "pov_inside_deity", "modern_objects"],
  "territory": "worldwide",
  "quality": "draft"
}
